Id,name,image,description,location,price,,
,Fortrose Bay Campsite,"https://media.pitchup.co.uk/images/5/image/private/s--TdUQkV1O--/c_fill,h_240,w_320/e_improve,fl_progressive/q_jpegmini/v1456309312/fortrose_bay_campsite/x134586.jpg.pagespeed.ic.X8cbCokt7A.webp","Quiet site by the sea in a famous spot for dolphin watchingFriendly atmosphere, ideal for familiesBarbecuing allowed on the local beach","Scotland",9.31,,
,Camping Resort Zugspitze,"https://media.pitchup.co.uk/images/4/image/private/s--8JhP_00Y--/c_fill,h_240,w_320/e_improve,fl_progressive/q_jpegmini/v1425460681/camping-resort-zugspitze/xcamping-resort-zugspitze--45.jpg.pagespeed.ic.z_BW4XjjKz.webp","Modern site with spectacular mountain viewsSauna and fitness room use included in rateWine bar and restaurant","Germany",30.86,,
,Camping Ciudad de Zaragoza,"https://media.pitchup.co.uk/images/5/image/private/s--gbi7dWpA--/c_fill,h_240,w_320/e_improve,fl_progressive/q_jpegmini/v1454683929/camping_ciudad_de_zaragoza/x129751.jpg.pagespeed.ic.PkFg2SdAOV.webp","Quiet site minutes away from Zaragoza city centreBetween the ports of Santander/Bilbao and Costa Brava beachesPools, playground, restaurant, café and sports areas","Spain",23.69,,
,Camping Le Bivouac,"https://media.pitchup.co.uk/images/5/image/private/s--e4HYToiN--/c_fill,h_240,w_320/e_improve,fl_progressive/q_jpegmini/v1437048608/camping-le-bivouac/x92687.jpg.pagespeed.ic.dT2imiNza_.webp","Mountain setting above Lake GenevaWithin walking distance of Châtel-Saint-DenisPool, bar, restaurant, shop and playground","Switzerland",20.9,,
,Camping Los Colorados de Chabelita,"https://media.pitchup.co.uk/images/2/image/private/s--JLAkSOyD--/c_fill,h_240,w_320/e_improve,fl_progressive/q_jpegmini/v1484303619/camping_colorados_de_chabelita/x209392.jpg.pagespeed.ic.LxBvfRkt7T.webp","Simple, friendly site a kilometre from the small town of PurmamarcaHot showers, launderette and kitchen with refrigeratorGood base for hiking, cycling and horse riding trips","Argentina",16.08,,
,Camping L'Orée de Deauville,"https://media.pitchup.co.uk/images/3/image/private/s--VqeD5ZP9--/c_fill,h_240,w_320/e_improve,fl_progressive/q_jpegmini/v1479998694/loree_de_deauville/200x150x199727.jpg.pagespeed.ic.Rjfpa6K5ir.webp","In a green park three kilometres from the sea at Blonville-sur-MerThree kilometres from AccrobrancheRestaurant serving local and international dishes","France",15.81,,
,Parque Cerdeira,"https://media.pitchup.co.uk/images/2/image/private/s--AbWLW72f--/c_fill,h_240,w_320/e_improve,fl_progressive/q_jpegmini/v1452532628/parque_de_campismo_da_cerdeira/x123383.jpg.pagespeed.ic.DppEhxGA-K.webp","In the Peneda-Gerês National ParkOver 20 years' experience providing camping holidaysOn-site restaurant, free hot showers and free wifi","Portugal",15.43,,
,Ace Hideaways,"https://media.pitchup.co.uk/images/5/image/private/s--MAn1ouJu--/c_fill,h_240,w_320/e_improve,fl_progressive/q_jpegmini/v1435849346/ace-hideaways/x90857.jpg.pagespeed.ic.Sb0o3hdHNY.webp","Wildlife havenWhitewater rafting, canoeing, fishing, paintball and lots more on siteOutdoor camp kitchen with firepits and log stools","Scotland",21.6,,
,Hjarbæk Fjord Camping,"https://media.pitchup.co.uk/images/5/image/private/s--5MC6V6b6--/c_fill,h_240,w_320/e_improve,fl_progressive/q_jpegmini/v1486033925/hjarbaek_fjord_camping/x214171.jpg.pagespeed.ic._n1_iZrGfk.webp","Peaceful site at the water's edge on the Hjarbæk FjordSwimming pool, games room, playground, trampoline and go-kart trackSeveral cycle routes and a walking trail start from the site","Denmark",16.04,,
,Campeggio Trevisago,"https://media.pitchup.co.uk/images/1/image/private/s--5z9V_syW--/c_fill,h_240,w_320/e_improve,fl_progressive/q_jpegmini/v1479722626/campeggio_trevisago/x198634.jpg.pagespeed.ic.yzfVGC26-6.webp","1km from a beach on the shore of Lake GardaAdults' and kids' swimming poolsNear a range of watersports and other outdoor activities","Italy",17.12,,
,Seecamping Masai Mara,"https://media.pitchup.co.uk/images/4/image/private/s--pNZuMgDT--/c_fill,h_240,w_320/e_improve,fl_progressive/q_jpegmini/v1484762563/seecamping_masai_mara/x210495.jpg.pagespeed.ic.xOcAC9SEnG.webp","Peaceful lakeside site on the edge of the Wienerwald forestWithin easy cycling distance of the centre of BerndorfLess than an hour from the historic attractions of Vienna","Austria",15.45,,
,Camping d'n Twist,"https://media.pitchup.co.uk/images/1/image/private/s--7LqonrON--/c_fill,h_240,w_320/e_improve,fl_progressive/q_jpegmini/v1456234457/camping_dn_twist/x134375.jpg.pagespeed.ic.SBbHxyasrx.webp","Family-friendly site in an area of hiking and cyclingPlayground, trampoline and summer paddling poolCollect eggs from the resident hens","The Netherlands",17.73,,
,Falkudden Camping och Stugby,"https://media.pitchup.co.uk/images/5/image/private/s--Nh-3BONE--/c_fill,h_240,w_320/e_improve,fl_progressive/q_jpegmini/v1465547819/falkudden_camping_och_stugby/x161136.jpg.pagespeed.ic.gVu2JCq8mM.webp","Small and scenic site with a lakeside beachAt the crossroads of three big cities: Borlänge, Västerås and UppsalaKiosk, café and grocery shop","Sweden",20.31,,
,Herbal Glamping Resort,"https://media.pitchup.co.uk/images/2/image/private/s--5S0cpPVJ--/c_fill,h_240,w_320/e_improve,fl_progressive/q_jpegmini/v1481376286/herbal_glaming_resort_ljubno/x203318.jpg.pagespeed.ic.iDbhyMcQdT.webp","Luxury safari tents in a green mountain settingWith private sauna and breakfast includedSauna, massage room, fishing and free wifi","Slovenia",17.88,,
,Camping Du Nord,"https://media.pitchup.co.uk/images/1/image/private/s--4uWM4LTb--/c_fill,h_240,w_320/e_improve,fl_progressive/q_jpegmini/v1492678607/camping_du_nord/x234052.jpg.pagespeed.ic.TMn8YU8GR0.webp","Surrounded by 20 national hiking and cycling trailsDiving, boating and fishing 20km away at Esch-sur-Sûre reservoirRiver fishing, waterslide, playground, shop and TV room","Luxembourg",23,,
,Camping Rovies,"https://media.pitchup.co.uk/images/2/image/private/s--27dxAYyo--/c_fill,h_240,w_320/e_improve,fl_progressive/q_jpegmini/v1493235094/camping_rovies/x236747.jpg.pagespeed.ic.CGIH0ImHbc.webp","Shaded seaside set between tranquil sea and wooded slopesA short drive to the famed hot spring spa town of AidipsosBook scuba diving sessions and horse riding lessons on site","Greece",12.66,,
,Bays Holiday Park,"https://media.pitchup.co.uk/images/1/image/private/s--Bdgw4kOO--/c_fill,h_240,w_320/e_improve,fl_progressive/q_jpegmini/v1479470637/bays_holiday_park/198384.jpg","Surrounded by natural bushland three minutes from Anna BayA short drive to beaches, shopping and many other attractionsPool with waterslides, solar-heated spa and free wifi","Australia",65.58,,
,Give Camping,"https://media.pitchup.co.uk/images/3/image/private/s--YkWYj2Jx--/c_fill,h_240,w_320/e_improve,fl_progressive/q_jpegmini/v1481713492/give_camping/x204173.jpg.pagespeed.ic.sWCOCjtJUm.webp","Family-friendly and family-run site five minutes' walk from Give cityClose to Legoland, Givskud Løvepark and Baboon CityHeated pool, cafeteria, miniature golf, trampolines and bouncy castle","Denmark",18.54,,
,Fossa Caravan and Camping Park,"https://media.pitchup.co.uk/images/2/image/private/s--SyIUIvdA--/c_fill,h_240,w_320/e_improve,fl_progressive/q_jpegmini/v1392037023/fossa-caravan-and-camping-park/246x184xfossa-caravan-and-camping-park.jpg.pagespeed.ic.R-WYv0ijHc.webp","Family-run site in the village of FossaOverlooking the MacGillycuddy ReeksDay tours and taxi service available","Republic of Ireland",0,,
,Camping le Cabellou Plage,"https://media.pitchup.co.uk/images/3/image/private/s--UwpfrjpO--/c_fill,h_240,w_320/e_improve,fl_progressive/q_jpegmini/v1467207295/camping_le_cabellou_plage/200x150x165877.jpg.pagespeed.ic.RIRA5GS_Kl.webp","On the Cabellou Peninsula with direct access to the beachWithin easy reach of Quimper, Pont-Aven and ConcarneauHeated pool with waterslides, snack bar and free wifi","France",13.54,,
,Crooked Creek RV Park,"https://media.pitchup.co.uk/images/4/image/private/s--MpbWhW69--/c_fill,h_240,w_320/e_improve,fl_progressive/q_jpegmini/v1477554786/crooked_creek_guide_service_cabins_rv_community/193422.jpg","Surrounded by forest on the Kenai PeninsulaIn the fishing village of KasilofFishing gear for sale, dining hall and wifi","USA",0,,
,Camping Bayona Playa,"https://media.pitchup.co.uk/images/1/image/private/s--4Krq5oD6--/c_fill,h_240,w_320/e_improve,fl_progressive/q_jpegmini/v1458748830/camping_bayona_playa/x141726.jpg.pagespeed.ic.OAe7ujWu0d.webp","Beach setting in the south of GaliciaOn-site supermarket and restaurant with a viewA ten-minute drive to the medieval village of Baiona","Spain",8.56,,
,The Country Place,"https://media.pitchup.co.uk/images/4/image/private/s--Hndhx76I--/c_fill,h_240,w_320/e_improve,fl_progressive/q_jpegmini/v1464276527/country_place/157087.jpg","Riverside campsite near the Shenandoah RiverBordered by the George Washington National ForestEnjoy canoeing, kayaking, swimming and horse-riding","USA",0,,
,Sauchope Links Park,"https://media.pitchup.co.uk/images/4/image/private/s--tsIw8cLT--/c_fill,h_240,w_320/e_improve,fl_progressive/q_jpegmini/v1425126403/sauchope-links-park/xsauchope-links-park--17.jpg.pagespeed.ic.B3Y5pryri6.webp","Within walking distance of the historic town of CrailA short drive from golf town St AndrewsHeated outdoor pool and indoor play area","Scotland",0,,
,Arch Rock Resort,"https://media.pitchup.co.uk/images/1/image/private/s--SGI2Rbn1--/c_fill,h_240,w_320/e_improve,fl_progressive/q_jpegmini/v1481102444/arch_rock_resort/202239.jpg","Spectacularly set beachfront site with stunning viewsMonkeyland primate sanctuary right next doorClean and up to date amenities including separate ladies' and gents'","South Africa",6.95,,
,Japodski Otoci,"https://media.pitchup.co.uk/images/3/image/private/s--RI-gKhDA--/c_fill,h_240,w_320/e_improve,fl_progressive/q_jpegmini/v1491399342/japodski_otoci/x229817.jpg.pagespeed.ic.Uv4PsOVZ_s.webp","Fun family site set across five islands among the Una river rapidsWildlife spotting at Plitvice Lakes National Park 40 minutes by carWorld-class whitewater rafting direct from the site","Bosnia and Herzegovina",25.39,,
,Kamp Vrhpolje,"https://media.pitchup.co.uk/images/3/image/private/s--utV4ljCF--/c_fill,h_240,w_320/e_improve,fl_progressive/q_jpegmini/v1488899502/kamp_vrhpolje/x222668.jpg.pagespeed.ic.z1DL49ghqb.webp","Small site in a village surrounded by vineyards and wineriesClose to hiking and mountain bike trails in the mountainsFree wifi, bike rental and homemade wine","Slovenia",17.35,,
,Camping Fusina Tourist Village,"https://media.pitchup.co.uk/images/4/image/private/s--enl98G0F--/c_fill,h_240,w_320/e_improve,fl_progressive/q_jpegmini/v1429086180/camping-fusina-tourist-village/xcamping-fusina-tourist-village--7.jpg.pagespeed.ic.4V5TwP6fi2.webp","Friendly site overlooking the city of VeniceFifteen-minute ferry journey to St Mark's SquareMarina, bar, restaurant, supermarket and multilingual staff on site","Italy",0,,
,Camping Le Relais,"https://media.pitchup.co.uk/images/5/image/private/s--bx1O4Jg6--/c_fill,h_240,w_320/e_improve,fl_progressive/q_jpegmini/v1455244570/aire_del_foy/x131613.jpg.pagespeed.ic.rvVKWJSX46.webp","At the edge of the wooded ArdennesPlay area and resident donkeysOn-site pond for fishing","Belgium",16.35,,
,Karoo Gariep Tented Camp,"https://media.pitchup.co.uk/images/4/image/private/s--U8JpbDvi--/c_fill,h_240,w_320/e_improve,fl_progressive/q_jpegmini/v1463054976/karoo_gariep_tented_camp/x153509.jpg.pagespeed.ic.HJJvC_4qO4.webp","Family-friendly campsite located in a nature reserve in HanoverSee rare bird species and hippos in the site surroundingsGo swimming and fishing on the Karoo river","South Africa",20.31,,
,Tyngsjö Vildmark,"https://media.pitchup.co.uk/images/2/image/private/s--ymlrJD4V--/c_fill,h_240,w_320/e_improve,fl_progressive/q_jpegmini/v1479994759/tyngsjoe_vildmark/x199688.jpg.pagespeed.ic.QlZRliObrI.webp","On the shores of Tyngsjö lake and surrounded by forestSauna for hireCovered sheltered deck, games room and snack restaurant","Sweden",59.09,,
,Park Farm Holiday Park,"https://media.pitchup.co.uk/images/2/image/private/s--Lr0c2uCf--/c_fill,h_240,w_320/e_improve,fl_progressive/q_jpegmini/v1393501661/park-farm-holiday-park/200x150xpark-farm-holiday-park-4.jpg.pagespeed.ic.C0GkfUGfiB.webp","Half a mile from award-winning Manorbier BeachTen beaches within ten milesFive miles from Tenby and close to Oakwood, Folly Farm and Heatherton","Wales",18.62,,
,Busselton Holiday Village,"https://media.pitchup.co.uk/images/1/image/private/s--8Fewp5LV--/c_fill,h_240,w_320/e_improve,fl_progressive/q_jpegmini/v1479025108/busselton_holiday_village/196872.jpg","Family-friendly site close to the beachSwimming pool, playground and cooking facilities on site30km from the Margaret River wine-producing region","Australia",20.73,,
,Recreatiecentrum de Eikenhof,"https://media.pitchup.co.uk/images/3/image/private/s--A-Btb_U---/c_fill,h_240,w_320/e_improve,fl_progressive/q_jpegmini/v1445888922/recreatiecentrum-de-eikenhof/x109203.jpg.pagespeed.ic.Xjyh9C-rsN.webp","Modern family-run campsite with excellent facilitiesCampsite is located on the edge of Weerribben-Wieden Nature ParkCampsite offers a heated pool, indoor playground, restaurant and bar","The Netherlands",10.15,,
,Giant Redwoods RV Park and Camp,"https://media.pitchup.co.uk/images/2/image/private/s--BVJq42k1--/c_fill,h_240,w_320/e_improve,fl_progressive/q_jpegmini/v1486744461/giant_redwoods_rv_park_camp/216495.jpg","Riverside site next to the Humboldt Redwoods State ParkPlayground, volleyball court, dog park and horseshoes pitClose to Highway 101 and the world-famed Avenue of the Giants","USA",0,,
,Heart of Nature Family Camp,"https://media.pitchup.co.uk/images/1/image/private/s--9s6X9tTy--/c_fill,h_240,w_320/e_improve,fl_progressive/q_jpegmini/v1421399978/family-camp-heart-of-nature/xfamily-camp-heart-of-nature--3.jpg.pagespeed.ic.pOJj9gWyLJ.webp","Family-run site 17km from the A1 Zagreb-Rijeka highwayPeaceful atmosphere among green surroundingsHeated pool, restaurant, barbecue area, souvenir shop and free wifi","Croatia",14.09,,
,Camping Bella Austria,"https://media.pitchup.co.uk/images/4/image/private/s--U5-k8-xc--/c_fill,h_240,w_320/e_improve,fl_progressive/q_jpegmini/v1463127890/camping_bella_austria/153902.jpg","Family-run site in a mountain settingHeated lagoon pool with shallow watersSports area, bike hire and summer entertainment","Austria",19.46,,
,Acorn Yurt,"https://media.pitchup.co.uk/images/4/image/private/s--2RHJ3VEP--/c_fill,h_240,w_320/e_improve,fl_progressive/q_jpegmini/v1433405078/acorn-yurt/200x150x86192.jpg.pagespeed.ic.GJZJ4L2xMX.webp","Romantic and peaceful Herefordshire hideaway in a wildlife havenWelcome pack (and wine) provided on arrivalTwo miles from Kingsland village","England",0,,
,Carra Caravan and Camping Park,"https://media.pitchup.co.uk/images/2/image/private/s--4mfOrnVb--/c_fill,h_240,w_320/e_improve,fl_progressive/q_jpegmini/v1476818885/carra-caravan-and-camping-park/246x184x191550.jpg.pagespeed.ic.KRy04zacWI.webp","Friendly family site in a traditional Irish villageClose to pubs, shops and miles of country walksDisabled access and free wifi","Republic of Ireland",0,,
,Camping Murinsel,"https://media.pitchup.co.uk/images/4/image/private/s--vHvVBbKZ--/c_fill,h_240,w_320/e_improve,fl_progressive/q_jpegmini/v1489652111/camping_murinsel/x224740.jpg.pagespeed.ic.H3Zyyh5YJ9.webp","Dog-friendly site next to a small lake on the outskirts of GroßlobmingNumerous hiking and mountain bike trails for all abilities nearbyRestaurant, lounge, free wifi, playground and dog park","Austria",18,,
,Camp Vodenca,"https://media.pitchup.co.uk/images/4/image/private/s--k3_pTduc--/c_fill,h_240,w_320/e_improve,fl_progressive/q_jpegmini/v1485881768/camp_vodenca/x213714.jpg.pagespeed.ic.Kxgsjzgbfq.webp","A shaded site by the Soča river and surrounded by the Julian AlpsOn the border of Triglav National ParkBar, shared kitchen, barbecues, campfire area and multisports pitch","Slovenia",11.82,,
,Camping Hermitage,"https://media.pitchup.co.uk/images/4/image/private/s--6xMjYz3e--/c_fill,h_240,w_320/e_improve,fl_progressive/q_jpegmini/v1460260640/camping_hermitage/x145724.jpg.pagespeed.ic.5ptQW57xYI.webp","Comfort in the middle of nature - indoor and outdoor pool, saunaChildren friendly - playground, playroom and kids-poolTyrolean and Mediterranean restaurant - pizzeria - take-away service","Italy",8.72,,
,Camping Naabtal-Pielenhofen,"https://media.pitchup.co.uk/images/2/image/private/s--sIsxKGhn--/c_fill,h_240,w_320/e_improve,fl_progressive/q_jpegmini/v1444986972/camping-naabtal-pielenhofen/x107575.jpg.pagespeed.ic.EYb0Lr7hjR.webp","Located on the banks of the river NaabSurrounded by lush meadows and forestsSauna and solarium available on site","Germany",19.46,,
,Campingplatz Naumburg,"https://media.pitchup.co.uk/images/1/image/private/s--R-Gtkylz--/c_fill,h_240,w_320/e_improve,fl_progressive/q_jpegmini/v1413901752/campingplatz-naumburg/xcampingplatz-naumburg.jpg.pagespeed.ic.ya9UmCmd6U.webp","In the spa area of HesseSauna on siteLess than ten minutes' walk from the medieval town of Naumburg","Germany",19.17,,
,Camping Neue Donau,"https://media.pitchup.co.uk/images/1/image/private/s--1_pwMYSQ--/c_fill,h_240,w_320/e_improve,fl_progressive/q_jpegmini/v1481025997/camping_wien_neue_donau/201978.jpg","In the Danube Recreational Zone, half an hour from central ViennaPlayground, beach volleyball and cycle hireNext to the Donauradweg riverside cycle path","Austria",15.97,,
,Ekeby Camping,"https://media.pitchup.co.uk/images/1/image/private/s--UTfv0jnw--/c_fill,h_240,w_320/e_improve,fl_progressive/q_jpegmini/v1469389552/ekeby_camping/x171801.jpg.pagespeed.ic.zWsXMB3olT.webp","Peaceful site on the shores of a fishing lakeDirect access to a family-friendly sandy beachFree wifi, playground and on-site café with lake views","Sweden",5.91,,
,Cabañas Inti-Killa,"https://media.pitchup.co.uk/images/2/image/private/s--zPkXZav1--/c_fill,h_240,w_320/e_improve,fl_progressive/q_jpegmini/v1484142109/cabanas_inti_killa/x208717.jpg.pagespeed.ic.z2Sxy7jM3L.webp","Peaceful village site nine kilometres from Salvador de JujuyA short drive from Los Alisos damBook activities including birdwatching, horse riding and hiking","Argentina",0,,
,Camping Villamar,"https://media.pitchup.co.uk/images/5/image/private/s--4NMpO-U5--/c_fill,h_240,w_320/e_improve,fl_progressive/q_jpegmini/v1445338434/camping-villamar/x108236.jpg.pagespeed.ic.fnQuwqVck8.webp","With an indoor heated pool and an outdoor poolLarge pitches and great facilitiesAll year round entertainment","Spain",12.73,,
,Eko Resort Pod Veliko Planino,"https://media.pitchup.co.uk/images/3/image/private/s--l98ntQ5c--/c_fill,h_240,w_320/e_improve,fl_progressive/q_jpegmini/v1483625358/eko_resort_pod_veliko_planino/x207729.jpg.pagespeed.ic.e3UOPBKyyY.webp","Eco resort a 30-minute drive from Ljubljana airportWildlife zoo, beach and cyclocross bike trailSauna, massage treatments, bike and hiking tours, free wifi","Slovenia",110.01,,
,Carlton Meres Country Park,"https://media.pitchup.co.uk/images/4/image/private/s--LF4rFZPW--/c_fill,h_240,w_320/e_improve,fl_progressive/q_jpegmini/v1427460263/carlton-meres-country-park/200x150xcarlton-meres-country-park--36.jpg.pagespeed.ic.BFd5YOAOVl.webp","Woodland setting with two well-stocked fishing lakesHeated outdoor pool, sauna, steam room, fitness suite and bar on siteSeven miles from the Suffolk Heritage Coast at Aldeburgh","England",17.09,,
,Treloy Touring Park,"https://media.pitchup.co.uk/images/5/image/private/s--MKEm8dyn--/c_fill,h_240,w_320/e_improve,fl_progressive/q_jpegmini/v1455536042/treloy-touring-park/200x150x132318.jpg.pagespeed.ic.7m5_slbxaw.webp","Close to Newquay and within a few minutes' drive of several beachesHeated outdoor pool, café, bar and takeawayClose to Treloy Golf Club and 1.4 miles from the Boardmasters venue","England",55,,
,Jacaranda Holiday Park,"https://media.pitchup.co.uk/images/2/image/private/s--jyz_I3EC--/c_fill,h_240,w_320/e_improve,fl_progressive/q_jpegmini/v1479426356/gateway_lifestyle_north_haven/198322.jpg","Landscaped park by a river, near the beachRange of watersports available nearby2km from the walking trails of Dooragan National Park","Australia",15.23,,
,Camping Terme Ptuj,"https://media.pitchup.co.uk/images/2/image/private/s--Tt6cQrjf--/c_fill,h_240,w_320/e_improve,fl_progressive/q_jpegmini/v1489676055/camping_terme_ptuj/x224914.jpg.pagespeed.ic.TYIde18Elq.webp","Family site with waterpark, thermal spa and wellness treatmentsWindsurfing, sailing, kitesurfing, kayaking and more at Lake PtujRestaurant, snackbar, shop and outdoor fitness classes","Slovenia",28.53,,
,Natura Glamping,"https://media.pitchup.co.uk/images/5/image/private/s--jcKcdK8A--/c_fill,h_240,w_320/e_improve,fl_progressive/q_jpegmini/v1469632757/natura_glamping/x172861.jpg.pagespeed.ic.nOWdQWuFCn.webp","Family-run business surrounded by countryside and mountainsLuxury glamping domes with balcony, free wifi and breakfastCommunal garden and terrace, games room and tour desk","Portugal",20,,
,Armidale Tourist Park,"https://media.pitchup.co.uk/images/1/image/private/s--ZxQb1Q9z--/c_fill,h_240,w_320/e_improve,fl_progressive/q_jpegmini/v1483048608/armidale_tourist_park/206692.jpg","Family-friendly campground in ArmidaleEasy access to nature attractions like the Wollomombi FallsPool, tennis, jumping pillow and undercover barbecue area","Australia",22,,
,Hillview Caravan Park,"https://media.pitchup.co.uk/images/4/image/private/s--hdUSaAuq--/c_fill,h_240,w_320/e_improve,fl_progressive/q_jpegmini/v1485870485/hillview_caravan_park/213492.jpg","Family park with views of the Mount Burr RangeCanunda National Park and Lake Bonney less than 20 kilometres awayPlayground, trampoline, free gas barbecues and campfire wood provided","Australia",16.92,,
,Camping Joie de Vivre,"https://media.pitchup.co.uk/images/3/image/private/s--FLDpCxnu--/c_fill,h_240,w_320/e_improve,fl_progressive/q_jpegmini/v1490281248/camping_joie_de_vivre_quebec_canada/226524.jpg","Quiet site just off a main road 20 kilometres from central MontrealClose to golf, horse riding and bike path as well as city attractionsSwimming pool, miniature golf, canteen and entertainment programme","Canada",17.91,,
,Gorse Hill Farm,"https://media.pitchup.co.uk/images/5/image/private/s--5b4424cT--/c_fill,h_240,w_320/e_improve,fl_progressive/q_jpegmini/v1493977827/gorse_hill_farm/x239223.jpg.pagespeed.ic.VgwIN9oMfe.webp","In the Mourne mountains with easy access to the Trassey TrackClose to Newcastle, the coast and Tullymore Forest ParkWell-equipped kitchen and communal barn with woodburning stove","Northern Ireland",0,,
,Braidhaugh Holiday Park,"https://media.pitchup.co.uk/images/4/image/private/s--S9fxYm78--/c_fill,h_240,w_320/e_improve,fl_progressive/q_jpegmini/v1423735902/braidhaugh-holiday-park/xbridge-view_braidhaugh-holiday-park.jpg.pagespeed.ic.BCQylbiCkF.webp","Riverbank glamping with mountain viewsFish for salmon and trout on private stretch of the riverHeated amenities block with free hot showers","Scotland",22.23,,
,Camping Lopari,"https://media.pitchup.co.uk/images/5/image/private/s--B7hzdKl5--/c_fill,h_240,w_320/e_improve,fl_progressive/q_jpegmini/v1452848519/marina-losinj/x124754.jpg.pagespeed.ic.KvUVzLdTjE.webp","Direct access to the beachDog-friendly beach nearby","Croatia",16.92,,
,Callanish Camping,"https://media.pitchup.co.uk/images/1/image/private/s--0Cmxllnl--/c_fill,h_240,w_320/e_improve,fl_progressive/q_jpegmini/v1423732400/callanish-camping/xcallanish-camping-sgadan-pod.jpg.pagespeed.ic.ZaLJ58-ZC6.webp","Heated, double-glazed and fully insulated island podsWith kettle, microwave and mini fridgeShowers, toilets and separate washroom","Scotland",12.66,,
,Terrassen-Camping Traisen,"https://media.pitchup.co.uk/images/4/image/private/s--4KDG7jf8--/c_fill,h_240,w_320/e_improve,fl_progressive/q_jpegmini/v1478513400/terrassen_camping_traisen/x195651.jpg.pagespeed.ic.QBzQtmATTf.webp","Family-friendly rural site within walking distance of town centreCafé-bistro, swimming pool and playgroundNear hiking and cycle trails for all abilities","Austria",0,,
,Eco Camping Cabin,"https://media.pitchup.co.uk/images/1/image/private/s--eolMVnr4--/c_fill,h_240,w_320/e_improve,fl_progressive/q_jpegmini/v1480689244/eco_camping_cabin/x201333.jpg.pagespeed.ic.D8xt6FlVze.webp","Traditional wooden camping cabin with saunaQuiet, back-to-basics rural retreat10 miles from the harbour at Tobermory","Scotland",0,,
,Loughcrew Megalithic Centre,"https://media.pitchup.co.uk/images/3/image/private/s--Fzx4Ga_W--/c_fill,h_240,w_320/e_improve,fl_progressive/q_jpegmini/v1472738948/loughcrew-megalithic-centre/246x184x183181.jpg.pagespeed.ic.IlsFN0eN0d.webp","In the Loughcrew hills 45 minutes from DublinPeaceful surroundings with mature trees, museum and events hallClose to the ancient Loughcrew complex","Republic of Ireland",12,,
,Camping und Bungalowpark Ottermeer,"https://media.pitchup.co.uk/images/3/image/private/s--kuSRS1Ll--/c_fill,h_240,w_320/e_improve,fl_progressive/q_jpegmini/v1424251701/camping-und-bungalowpark-ottermeer/xcamping-und-bungalowpark-ottermeer--27.jpg.pagespeed.ic.LUo7lMxcFw.webp","Spacious site alongside a recreational pond in OttermeerPlayground, sports ground and bar on siteClose to cycling trails along the Fehn wetlands","Germany",19.76,,
,Camping Kohnenhof,"https://media.pitchup.co.uk/images/2/image/private/s--xdMWzruh--/c_fill,h_240,w_320/e_improve,fl_progressive/q_jpegmini/v1465137492/camping_kohnenhof/x159460.jpg.pagespeed.ic.xRJW4SyKDd.webp",Riverside location,"Luxembourg",13.54,,
