Id,name,image,description,location,price,,
,Vilaggio Colombo,"https://media.pitchup.co.uk/images/1/image/private/s--xe373OMS--/c_fill,h_240,w_320/e_improve,fl_progressive/q_jpegmini/v1490880141/vilaggio_colombo/x228250.jpg.pagespeed.ic.P1nLnpKxkO.webp","Quiet hilltop site on the Italian Palms RivieraSport fishing, diving, snorkelling and sailing 10 minutes' drive awayOutdoor pool and paddling pool, snack bar, tennis court and playground","Italy",0,,
,Newperran Holiday Park,"https://media.pitchup.co.uk/images/2/image/private/s--EWzOSeai--/c_fill,h_240,w_320/e_improve,fl_progressive/q_jpegmini/v1416406727/newperran-holiday-park/200x150xnewperran-holiday-park-.jpg.pagespeed.ic.Rkq5FxnXbn.webp","Award-winning family-run park with Cornish sea viewsHeated indoor pool, kids' pool, games room and adventure playgroundVery clean facilities in modern shower and toilet blocks","England",14,,
,Camping Parco Capraro,"https://media.pitchup.co.uk/images/4/image/private/s--MdRrcDcN--/c_fill,h_240,w_320/e_improve,fl_progressive/q_jpegmini/v1445876638/camping-parco-capraro/x109154.jpg.pagespeed.ic.3lG4s8CxBY.webp","Family-run campsite a short walk from the beachNear a pine forestTwo pools, green sunbathing space and bar-restaurant","Italy",20,,
,Parc Heelderpeel,"https://media.pitchup.co.uk/images/4/image/private/s--l6GvLrCe--/c_fill,h_240,w_320/e_improve,fl_progressive/q_jpegmini/v1450349970/narvik_homeparc_heelderpeel/x119896.jpg.pagespeed.ic.zRC84rxnmn.webp","Peaceful site in the Limburg countrysideNear the swimming, surfing and other watersports of the Maas riverSwimming lake, playground, sports court and several fields for play","The Netherlands",10.9,,
,Fontygary Leisure Park,"https://media.pitchup.co.uk/images/2/image/private/s--nhCOAd86--/c_fill,h_240,w_320/e_improve,fl_progressive/q_jpegmini/v1441295154/fontygary-bay-touring-park/200x150x101772.jpg.pagespeed.ic.eaVh-QBllP.webp","Family-run premier park with wonderful sea viewsBrand new touring site for 2015Top-notch Indian restaurant and modern facilities","Wales",16.08,,
,Organic Farm Slibar,"https://media.pitchup.co.uk/images/2/image/private/s--HMeYcTsg--/c_fill,h_240,w_320/e_improve,fl_progressive/q_jpegmini/v1492957528/glamping_slovenia_organic_farm/x235216.jpg.pagespeed.ic.R80A6JqTT-.webp","Working organic farm site set among orchards, meadows and mountainsWithin 20 minutes' drive of Lake Bled, Vingtar Gorge and Lake BohinjOrganic farm shop selling Slovenia's first organic beer","Slovenia",20.71,,
,Càmping Saiol,"https://media.pitchup.co.uk/images/2/image/private/s--IyPrBcTc--/c_fill,h_240,w_320/e_improve,fl_progressive/q_jpegmini/v1480335141/camping_saiol/x200306.jpg.pagespeed.ic.why84NNt53.webp","Quiet, family-friendly siteRural site next to a natural swimming areaLots of outdoor activities nearby","Spain",42.31,,
,Cub River Guest Ranch,"https://media.pitchup.co.uk/images/4/image/private/s--9kuIchr2--/c_fill,h_240,w_320/e_improve,fl_progressive/q_jpegmini/v1493827469/cub_river_lodge_guest_house_and_rv_park_llc/238671.jpg","Peaceful rural site seven miles from Preston, IdahoClose to hiking, biking and horse riding in Cache National ForestWarm chemical-free swimming pool fed with fresh springwater","USA",22,,
,Camping La Font,"https://media.pitchup.co.uk/images/1/image/private/s--Z_n0iiLP--/c_fill,h_240,w_320/e_improve,fl_progressive/q_jpegmini/v1493226453/camping_la_font/x236715.jpg.pagespeed.ic.mXw-xlAojf.webp","Peaceful site surrounded by the Ports de Tortosa-Beseit mountainsVia Ferrata, caves, paintballing and 4x4 excursions a short drive awayOutdoor pool, barbecue area, multi-sports pitch, bar and restaurant","Spain",13.51,,
,Parque Montargil,"https://media.pitchup.co.uk/images/3/image/private/s--9vCb9Pmu--/c_fill,h_240,w_320/e_improve,fl_progressive/q_jpegmini/v1429710084/parque-montargil/xparque-montargil--10.jpg.pagespeed.ic.jGQpRmFLT6.webp","Lakeside site in Portugal's peaceful Ponte de Sor regionLarge pool, bar-restaurant, sports field and wifiAbout 90 minutes' drive from Lisbon","Portugal",17.73,,
,Mystical Adventures,"https://media.pitchup.co.uk/images/2/image/private/s--nDJI3-yH--/c_fill,h_240,w_320/e_improve,fl_progressive/q_jpegmini/v1461121642/camping_mystical_adventures/147903.jpg","Family-friendly and very welcoming campsiteExcursions with trekking, rafting, hiking, climbing, horse ridingInca ruins rising above Ollantaytambo","Peru",12.3,,
,Bed & Wheels,"https://media.pitchup.co.uk/images/4/image/private/s--u0-C307N--/c_fill,h_240,w_320/e_improve,fl_progressive/q_jpegmini/v1474491470/bed_wheels/x187163.jpg.pagespeed.ic.tbfd3HZX-a.webp","In a quiet seaside resort with over 5km of white sandsDirect access to the beachPool, playground and wifi","Chile",69,,
,Creta Camping,"https://media.pitchup.co.uk/images/3/image/private/s--pJuy1_8r--/c_fill,h_240,w_320/e_improve,fl_progressive/q_jpegmini/v1479812275/creta_camping/x199156.jpg.pagespeed.ic.pEPSThXJ4C.webp","Wooded seafront site in Kato Gouves with direct beach access15 kilometres from Heraklion and Knossos PalacePlayground, beach bar and restaurant with local entertainment","Greece",17.77,,
,Campingplatz Grafenlehen,"https://media.pitchup.co.uk/images/5/image/private/s--D8fJTlUK--/c_fill,h_240,w_320/e_improve,fl_progressive/q_jpegmini/v1487591689/campingplatz-grafenlehen/x218651.jpg.pagespeed.ic.OqOSjL5jAP.webp","Woodland site by a river in rural BavariaFive minutes' walk from the Königssee in Berchtesgaden National ParkRestaurant serving local dishes, snacks and takeaways","Germany",0,,
,Camping Les Pinèdes,"https://media.pitchup.co.uk/images/5/image/private/s--LoqDgzQk--/c_fill,h_240,w_320/e_improve,fl_progressive/q_jpegmini/v1483619381/camping_les_pinedes/200x150x207676.jpg.pagespeed.ic.ow2GMO8BF0.webp","Colourful and well-maintained site on the banks of the Loup riverA kilometre from La Colle-sur-LoupPlenty of leisure faciities, a short drive from the Mediterranean","France",0,,
,Camping Flims,"https://media.pitchup.co.uk/images/4/image/private/s--uZovxKfu--/c_fill,h_240,w_320/e_improve,fl_progressive/q_jpegmini/v1442827341/camping-flims/x103856.jpg.pagespeed.ic.J0QT7bzfIv.webp","Skiing and snowboarding, hiking and bikingIdeal base for family adventure holidaysClose to Laax ski resort with 235km pistes, snow parks and a superpipe","Switzerland",9.59,,
,Camping La Union,"https://media.pitchup.co.uk/images/5/image/private/s--QKyI4Xy4--/c_fill,h_240,w_320/e_improve,fl_progressive/q_jpegmini/v1425296962/camping-la-union/xcamping-la-union--26.jpg.pagespeed.ic.-IMMJUfHOh.webp","Fifteen minutes' walk from PortAventura theme parkShort walk from a sandy beachPools, playground, bar and communal barbecues","Spain",16.55,,
,Strand Camping,"https://media.pitchup.co.uk/images/3/image/private/s--oz4JEC-8--/c_fill,h_240,w_320/e_improve,fl_progressive/q_jpegmini/v1429024135/strand-camping/246x184xstrand-camping--8.jpg.pagespeed.ic.2WBgGyc9IO.webp","Small and friendly site in Doonbeg on the Wild Atlantic WayA few steps from the bay with direct access to the beachShort stroll to pubs, restaurants and shops","Republic of Ireland",15.84,,
,Camping Colline de Rabais,"https://media.pitchup.co.uk/images/4/image/private/s--WrKJ6AE4--/c_fill,h_240,w_320/e_improve,fl_progressive/q_jpegmini/v1484140519/camping_colline_de_rabais/x208714.jpg.pagespeed.ic.LWnjJRAK9e.webp","Large site close to the borders with France and LuxembourgPool with plenty of room alongside for sunbathingRegional dishes and bistro meals served up at the bar-restaurant","Belgium",20,,
,Färnebofjärden Camping,"https://media.pitchup.co.uk/images/3/image/private/s--mS09reRK--/c_fill,h_240,w_320/e_improve,fl_progressive/q_jpegmini/v1464119070/faernebofjaerden_camping/x156472.jpg.pagespeed.ic.T_zffGyanz.webp","Right on the shores of Lake DalälvenGreat fishing opportunities with pike, walleye and perchHire a motorboat, canoe or kayak","Sweden",5.78,,
,Kamp Dolenjske Toplice,"https://media.pitchup.co.uk/images/2/image/private/s--9TFcEJkg--/c_fill,h_240,w_320/e_improve,fl_progressive/q_jpegmini/v1484548584/kamp_dolenjske_toplice/x209900.jpg.pagespeed.ic.9BQwFYyJYe.webp","Riverside site in spa resort of Dolenjske TopliceNext to a wellness centre with swimming pool and spaClose to forest walks and river activities including rafting","Slovenia",0,,
,Camping Bockenauer Schweiz,"https://media.pitchup.co.uk/images/5/image/private/s--TVMM5On8--/c_fill,h_240,w_320/e_improve,fl_progressive/q_jpegmini/v1469000586/camping_bockenauer_schweiz_/x170719.jpg.pagespeed.ic.DA6eyygnGA.webp","Spacious pitches besides beautiful woodsFishing pond and quiet countryside locationOn-site restaurant","Germany",21.81,,
,Echo Basin Ranch,"https://media.pitchup.co.uk/images/4/image/private/s--M3Pk21HK--/c_fill,h_240,w_320/e_improve,fl_progressive/q_jpegmini/v1492713306/echo_basin_cabin_and_rv_resort/234469.jpg","Quiet, family-owned resort in the foothills of the San Juan MountainsNine miles from Mesa Verde National ParkSwimming pool, volleyball court, playground, clubhouse and free wifi","USA",21.11,,
,Camping Village Città di Milano,"https://media.pitchup.co.uk/images/2/image/private/s--dVo28TYU--/c_fill,h_240,w_320/e_improve,fl_progressive/q_jpegmini/v1485517102/camping_village_citta_di_milano/x212461.jpg.pagespeed.ic.CsaQ8tvj4g.webp","Parkland location 7km from the centre of Milan: bus outside the site3 kilometres from AC Milan's San Siro StadiumRestaurant/pizzeria, sports facilities and petting zoo","Italy",12.69,,
,Via Claudia Camping,"https://media.pitchup.co.uk/images/5/image/private/s--7VVZTp_R--/c_fill,h_240,w_320/e_improve,fl_progressive/q_jpegmini/v1429693103/via-claudia-camping/xvia-claudia-camping-.jpg.pagespeed.ic.AqiP6OSIjV.webp","Beautiful views of the emerald LechseeExcursions available to surrounding local attractionsTake a summer dip in their privately owned Baderwäldle Lake","Germany",18,,
,Campeggio Maremma Sans Souci,"https://media.pitchup.co.uk/images/3/image/private/s--ngMnWOOq--/c_fill,h_240,w_320/e_improve,fl_progressive/q_jpegmini/v1482228712/campeggio_maremma_sans_souci/x205609.jpg.pagespeed.ic.FZOZlj33ZX.webp","In a pine wood right by the seaDirect access to a private sandy beachRestaurant, pizzeria, snack bar and supermarket","Italy",55,,
,Løkken By Camping,"https://media.pitchup.co.uk/images/1/image/private/s--Ix275Bxe--/c_fill,h_240,w_320/e_improve,fl_progressive/q_jpegmini/v1488297444/lokken_by_camping/x220995.jpg.pagespeed.ic.Dykx0oA08l.webp","Family campsite 300 metres from the center of Lokken400 metres from a popular sandy beach and close to the North Sea TrailMiniature golf, playground, bistro, shop and big common room","Denmark",12,,
,"""C"" Lazy Moose RV Park","https://media.pitchup.co.uk/images/5/image/private/s--op5gG_wy--/c_fill,h_240,w_320/e_improve,fl_progressive/q_jpegmini/v1492976192/lazy_moose_rv_park_and_campground/235303.jpg","Quiet site surrounded by wilderness 10 miles from SalchaNear great fishing spots on Tanana River and in nearby lakesGift shop with snacks and coffee, plus free wifi","USA",0,,
,Oceanside Beachfront RV Resort,"https://media.pitchup.co.uk/images/3/image/private/s--gul5oDAd--/c_fill,h_240,w_320/e_improve,fl_progressive/q_jpegmini/v1455561258/oceanside-beachfront-rv-resort/132478.jpg","Coastal park set among state parks, sand dunes and marine reservesWhale watching, seal and sea lion spotting, diving and paraglidingFishing for crabs, crab shack takeaway, picnic tables and more","USA",10.55,,
,Ötscherland Camping,"https://media.pitchup.co.uk/images/4/image/private/s--bAlEQVA8--/c_fill,h_240,w_320/e_improve,fl_progressive/q_jpegmini/v1481702905/oetscherland_camping/204033.jpg","Family-run riverside and mountain site in the foothills of the AlpsWithin a 15-minute walk of the Lunzersee and Lunz am See villageBig communal room with TV; guest kitchen; spacious play area","Austria",23.15,,
,Gracetown Caravan Park,"https://media.pitchup.co.uk/images/4/image/private/s--xw8-pBMc--/c_fill,h_240,w_320/e_improve,fl_progressive/q_jpegmini/v1478586289/gracetown_caravan_park/195831.jpg","Rural site on a 13-acre bush park a few minutes' drive from the coastGreat base for exploring the Margaret River wine regionTennis court, volleyball court, miniature golf and campers' kitchen","Australia",0,,
,Camping Gosén,"https://media.pitchup.co.uk/images/2/image/private/s--BBmbaMlr--/c_fill,h_240,w_320/e_improve,fl_progressive/q_jpegmini/v1487265073/gosen/x217866.jpg.pagespeed.ic.bERlLzzf5V.webp","Peaceful riverside site set in the famed volcanic region of HerediaAccess to challenging hikes through rainforests and around volcanoesBar, restaurant, gym, football pitch, TV room and barbecue","Costa Rica",0,,
,Vakantiepark Het Grote Bos,"https://media.pitchup.co.uk/images/1/image/private/s--Gn1WiALB--/c_fill,h_240,w_320/e_improve,fl_progressive/q_jpegmini/v1487241126/vakantiepark_het_grote_bos_/x217595.jpg.pagespeed.ic.XKmzU6gBE-.webp","Kid-friendly woodland site less than half an hour's drive from UtrechtMuseums, historical architecture and UNESCO-listed site within 21kmGames room, multisports field, survival course, nature pond and BMXing","The Netherlands",16.92,,
,Camping Eden,"https://media.pitchup.co.uk/images/4/image/private/s--Vz3mzP1E--/c_fill,h_240,w_320/e_improve,fl_progressive/q_jpegmini/v1480677130/campeggio_villaggio_internazionale_eden/x201259.jpg.pagespeed.ic.je_H1PTDmJ.webp","Lake Garda site in a spectacular settingPools, waterslides, private beach, playground and sports groundsTennis courts, beach volleyball area and football pitch","Italy",0,,
,Pajala Camping,"https://media.pitchup.co.uk/images/4/image/private/s--sQ5OwhaD--/c_fill,h_240,w_320/e_improve,fl_progressive/q_jpegmini/v1463131873/pajala_camping/x153958.jpg.pagespeed.ic.IPOsr2kfWJ.webp","Direct access to the river TorneOn-site fishing, lots of wildlife and free saunaFamily-friendly campsite","Sweden",14.3,,
,Broadhembury Caravan and Camping Park,"https://media.pitchup.co.uk/images/5/image/private/s--hRqvVSwe--/c_fill,h_240,w_320/e_improve,fl_progressive/q_jpegmini/v1399541287/broadhembury-caravan-camping-park/200x150xbroadhembury-caravan-camping-park-15.jpg.pagespeed.ic.wBoO7_ir82.webp","Award-winning park near AshfordLarge supermarket a few minutes awayPlay areas, games room, herb garden and campers' kitchen","England",14.81,,
,Recreatiepark De Oude Maas,"https://media.pitchup.co.uk/images/1/image/private/s--Cv2wVc2t--/c_fill,h_240,w_320/e_improve,fl_progressive/q_jpegmini/v1453889721/recreatiepark_de_oude_maas/x128015.jpg.pagespeed.ic.FYxfVFiRrq.webp","Spacious campsite overlooking the Oude Maas riverNext to a marine centre and yacht harbourA short drive to Rotterdam and Kinderdijk","The Netherlands",21.15,,
,Bear Run Campground,"https://media.pitchup.co.uk/images/2/image/private/s--nV602WOq--/c_fill,h_240,w_320/e_improve,fl_progressive/q_jpegmini/v1483048968/bear-run-campground/206715.jpg","Family-run site with direct access to Lake ArthurHeated outdoor pool, games room and shopKids' gem mine, kids' club and play area","USA",16.84,,
,Camping Los Coihues,"https://media.pitchup.co.uk/images/1/image/private/s--0poYxbK0--/c_fill,h_240,w_320/e_improve,fl_progressive/q_jpegmini/v1454873906/camping_hostel_los_coihues/x130213.jpg.pagespeed.ic.ed2gRcWCG1.webp","In Los Coihues village on the banks of the Gutiérrez lakeA kilometre from the entrance to Nahuel Huapi National ParkKitchen, wifi, barbecue area and bar","Argentina",13.54,,
,Camping Los Arribes,"https://media.pitchup.co.uk/images/2/image/private/s--QtVWBqUl--/c_fill,h_240,w_320/e_improve,fl_progressive/q_jpegmini/v1463671200/camping_los_arribes/x155445.jpg.pagespeed.ic.IktJ6_mtbL.webp","Easy access to Los Arribes del Duero Natural ParkIdeal for birdwatching and other outdoor activitiesTwo pools, on-site fishing, bar and restaurant","Spain",0,,
,Benalla Holiday Park,"https://media.pitchup.co.uk/images/3/image/private/s--3Xh4OTLi--/c_fill,h_240,w_320/e_improve,fl_progressive/q_jpegmini/v1484379603/gateway_lifestyle_benalla/209609.jpg","On the outskirts of Benalla, two hours from MelbourneWithin seven kilometres of two fishing and swimming lakesKitchen and communal barbecue: plenty of supplies 2km away in town","Australia",15,,
,Camping U Potoka,"https://media.pitchup.co.uk/images/5/image/private/s--t7e2gGcf--/c_fill,h_240,w_320/e_improve,fl_progressive/q_jpegmini/v1481546156/recreatie_b_b_u_potoka/x203480.jpg.pagespeed.ic.dCOe5hs4RG.webp","Scenic and quiet site surrounded by mountainsOrchard with pool and playgroundSet on a dairy with cheesemaking workshops in summer","Czech Republic",13.54,,
,Šotorišče Silva,"https://media.pitchup.co.uk/images/5/image/private/s--bQKPtOxF--/c_fill,h_240,w_320/e_improve,fl_progressive/q_jpegmini/v1484291264/sotorisce_silva/x209345.jpg.pagespeed.ic.drBudq8OhJ.webp","Pomurska site three kilometres from the town of LjutomerWith bike paths all around and bike hire on siteFree wifi, free train transfer, playground, pool and big barbecue yard","Slovenia",84.62,,
,Camping Le Rhodès,"https://media.pitchup.co.uk/images/4/image/private/s--ArZmsZ12--/c_fill,h_240,w_320/e_improve,fl_progressive/q_jpegmini/v1454000913/le_rhodes/x128400.jpg.pagespeed.ic.HdiyCONpNh.webp","Peaceful countryside site in the Belgian ArdennesTen kilometres from the French borderSurrounded by green space between Bouillon, Paliseul and Bièvre","Belgium",0,,
,Camping du Botza,"https://media.pitchup.co.uk/images/3/image/private/s--HZ1P90sK--/c_fill,h_240,w_320/e_improve,fl_progressive/q_jpegmini/v1411658930/camping-du-botza/xcamping-du-botza-15.jpg.pagespeed.ic.LDLgEzZDWf.webp","Surrounded by the spectacular scenery of the Valais mountain regionSpacious pitches and modern amenitiesRestaurant, pool and playground","Switzerland",19.4,,
,Camping Panorama,"https://media.pitchup.co.uk/images/2/image/private/s--3MgrTVOr--/c_fill,h_240,w_320/e_improve,fl_progressive/q_jpegmini/v1457432526/camping_panorama/x138278.jpg.pagespeed.ic.yeaeIpw6Xf.webp","Among spectacular scenery in the San Bartolo Nature ParkWithin ten minutes' drive to the beachPool, paddling pool, solarium and bar-restaurant","Italy",12.95,,
,Na-Bé Lavender Lodge and Spa,"https://media.pitchup.co.uk/images/2/image/private/s--2qlwYbm1--/c_fill,h_240,w_320/e_improve,fl_progressive/q_jpegmini/v1483614651/na_be_lavender_lodge_and_spa/x207609.jpg.pagespeed.ic.ceVl-hOe9i.webp","Luxurious eco-friendly glamping on a lavender farmClose to vineyards, historic cities and the Peneda-Gerês National ParkFreshwater swimming pool, restaurant and spa with homemade products","Portugal",14.35,,
,Laois Caravan and Camping,"https://media.pitchup.co.uk/images/3/image/private/s--exZq5L6j--/c_fill,h_240,w_320/e_improve,fl_progressive/q_jpegmini/v1464889745/laois-caravan-and-camping/246x184x158778.jpg.pagespeed.ic.95qo_vGZEM.webp","Small family-run farm a few kilometres from the M7Meet the sheep, goats, chickens and pigsSpacious communal room, kitchen and laundry room","Republic of Ireland",15,,
,Camping Village Roma,"https://media.pitchup.co.uk/images/3/image/private/s--VmALfUta--/c_fill,h_240,w_320/e_improve,fl_progressive/q_jpegmini/v1444120100/camping-village-roma/x105964.jpg.pagespeed.ic.9N8OmCe-TC.webp","Only 6.5km from the Coliseum, the Vatican and Rome's city centreEasy access to Colle Palatino and Ostia AnticaOutdoor swimming pool, restaurant and bar terrace","Italy",63.46,,
,Kamp Otočec,"https://media.pitchup.co.uk/images/4/image/private/s--80MJAhHX--/c_fill,h_240,w_320/e_improve,fl_progressive/q_jpegmini/v1489237140/kamp_otocec/x223624.jpg.pagespeed.ic.qyY4UQa3WZ.webp","On the banks of the river Krka, opposite the town of OtočecClose to thermal baths, castles, golf and adventure parkBike and canoe rental available on site","Slovenia",15.15,,
,Rubber Ducky Resort and Campground,"https://media.pitchup.co.uk/images/4/image/private/s--917SsWjT--/c_fill,h_240,w_320/e_improve,fl_progressive/q_jpegmini/v1477357694/rubber_ducky_resort_and_campground/x192829.jpg.pagespeed.ic.fFRujXqyDo.webp","Family-run park 20 minutes from WinnipegBumper boats, two heated pools and two hot tubsDuck pond, games room, playground and miniature golf","Canada",11.57,,
,Camping Mas Nou,"https://media.pitchup.co.uk/images/4/image/private/s--bEc4EG-8--/c_fill,h_240,w_320/e_improve,fl_progressive/q_jpegmini/v1443516299/camping-mas-nou/x104997.jpg.pagespeed.ic.2ywuwAmS52.webp","Relaxing family-owned site in the Golfo de RosasModern facilities including a large swimming poolMultisports area and bar/restaurant","Spain",0,,
,Linwater Caravan Park,"https://media.pitchup.co.uk/images/5/image/private/s--BYWyRRZs--/c_fill,h_240,w_320/e_improve,fl_progressive/q_jpegmini/v1415894623/linwater-caravan-park/xlinwater-caravan-park-.jpg.pagespeed.ic.UWoKoeX4hi.webp","Quiet campsite five miles from Edinburgh AirportShopping locally at Livingston Designer OutletNext to a country park and the Union Canal","Scotland",9.31,,
,Elixir Hotelik Caravan Camping,"https://media.pitchup.co.uk/images/1/image/private/s--PPR4aiCL--/c_fill,h_240,w_320/e_improve,fl_progressive/q_jpegmini/v1458284907/elixir/x140861.jpg.pagespeed.ic.rRWa19AULk.webp","Friendly site by Kisajno Lake and with direct access to a sandy beachSix kilometres from the town of GiżyckoPopular cycling territory: hire a bike on site","Poland",16.04,,
,Steiner's Camping and Lodge,"https://media.pitchup.co.uk/images/4/image/private/s--gpFnw4Jn--/c_fill,h_240,w_320/e_improve,fl_progressive/q_jpegmini/v1476354066/steiners_camping_and_lodge/x190407.jpg.pagespeed.ic.W0t0Ko6h2X.webp","Lakeside site in the popular Södra Venjan fishing areaRent boats and canoes on site for a small feeRestaurant with lakeside views","Sweden",15.45,,
,Camp Koren,"https://media.pitchup.co.uk/images/3/image/private/s--Lyq6swRY--/c_fill,h_240,w_320/e_improve,fl_progressive/q_jpegmini/v1488043732/camp_koren/x220320.jpg.pagespeed.ic.sOqpefW6R_.webp","Eco-friendly site on the banks of the Soča river in KobaridWater/sky sports, high ropes course, tours and adventure parkClimbing wall, playground, bar, sauna and TV room","Slovenia",55,,
,Camping Bosque De Gordon,"https://media.pitchup.co.uk/images/3/image/private/s--BEA43-Qg--/c_fill,h_240,w_320/e_improve,fl_progressive/q_jpegmini/v1460583738/camping_bosque_de_gordon/x146442.jpg.pagespeed.ic.0ti-UkB7M-.webp","In a green area of Spain known for its clear clean airOpposite a leisure complex with pools and sports courtsRestaurant, bar café, pool, play area and covered communal area","Spain",17.35,,
,Beachfront Hallidays Point,"https://media.pitchup.co.uk/images/3/image/private/s--rvTSHC3S--/c_fill,h_240,w_320/e_improve,fl_progressive/q_jpegmini/v1477003034/gateway_lifestyle_beachfront_hallidays/192096.jpg","Next to the Manning Valley sands of Black Head BeachA short drive from the busy towns of Forster and TareePool, Jacuzzi, playground and communal barbecue areas","Australia",20.39,,
,The Enchanted Campsite,"https://media.pitchup.co.uk/images/4/image/private/s--gnS-M_wz--/c_fill,h_240,w_320/e_improve,fl_progressive/q_jpegmini/v1454059431/the-enchanted-campsite/x128476.jpg.pagespeed.ic._doFauAI4A.webp","Northern Cyprus site new for 2016Only 2km from the beachQuiet place in a protected area","Cyprus",16.08,,
,Kam'Bati River Resort,"https://media.pitchup.co.uk/images/1/image/private/s--IJR6W022--/c_fill,h_240,w_320/e_improve,fl_progressive/q_jpegmini/v1487147579/kambati_river_resort/x217253.jpg.pagespeed.ic.BXDgQpixJP.webp","Family-friendly site on the banks of the Breede riverRestaurant/bar, miniature golf and outdoor swimming poolNear to national park, nature reserve and wineries","South Africa",31.15,,
,Cadmos Village,"https://media.pitchup.co.uk/images/4/image/private/s--nxSIDcxF--/c_fill,h_240,w_320/e_improve,fl_progressive/q_jpegmini/v1490010069/cadmos_village/x225497.jpg.pagespeed.ic.QlLF12A3nX.webp","Well-appointed eco-friendly treehouse 15km from DubrovnikNext to an adventure park and activity centre and near wineriesRestaurant serving local dishes and using traditional techniques","Croatia",18.11,,
,Les Amiaux,"https://media.pitchup.co.uk/images/3/image/private/s--LWPUME58--/c_fill,h_240,w_320/e_improve,fl_progressive/q_jpegmini/v1394637011/les-amiaux/200x150xles-amiaux-6.jpg.pagespeed.ic.NLqkwPcIn5.webp","Lively site over 30 acres and next to a pine forestWaterpark with water playgroundBeach 750 metres away via a peaceful woodland path","France",10.15,,
,Camping Internacional Marina Colbún,"https://media.pitchup.co.uk/images/2/image/private/s--JNvoKowY--/c_fill,h_240,w_320/e_improve,fl_progressive/q_jpegmini/v1464114967/camping_internacional_marina_colbun/156458.jpg","Family-friendly siteDirect access to a lakeside beachBoat trips in the Río Claro","Chile",12.65,,
,CosyCamp,"https://media.pitchup.co.uk/images/1/image/private/s--DIsG24g0--/c_fill,h_240,w_320/e_improve,fl_progressive/q_jpegmini/v1452156971/cosycamp/200x150x122683.jpg.pagespeed.ic.7f0izTQl3L.webp","Eco-friendly glamping park in a wildlife haven in south AuvergneWith botanical gardens, bird sanctuaries and a wellness centreCanoe on the river Loire flowing right outside the site","France",17.44,,
,Mt Barney Wilderness Retreat,"https://media.pitchup.co.uk/images/1/image/private/s--xMGHRy2X--/c_fill,h_240,w_320/e_improve,fl_progressive/q_jpegmini/v1485735809/mt_barney_wilderness_retreat/212880.jpg","Bush retreat with luxury touches in the McPherson Range mountainsHot showers, flushing toilets and fully-equipped kitchenWide range of bush walks marked from the camp","Australia",10.15,,
